{
  "schemaVersion": 3,
  "storeId": "123-sakai-inter",
  "storeName": "123堺インター店",
  "floors": [
    {
      "id": "legacy-slot",
      "label": "スロット（貸しレート確認待ち）",
      "width": 1040,
      "height": 1526,
      "coordinateBasis": "unknown",
      "islands": [
        {
          "id": "0a82c424-008c-42f4-9d65-271d1b64d852",
          "label": "上側外周・ジャグラーA（割当推定）",
          "shape": "custom",
          "geometry": {
            "x": 414,
            "y": 213.88,
            "points": [
              [
                414,
                213.88,
                12,
                12
              ],
              [
                414,
                183.65,
                12,
                12
              ],
              [
                414,
                153.41,
                12,
                12
              ],
              [
                418.24,
                123.53,
                12,
                12
              ],
              [
                432.19,
                97.01,
                12,
                12
              ],
              [
                454.87,
                77.31,
                12,
                12
              ],
              [
                482.98,
                67.15,
                12,
                12
              ],
              [
                512.77,
                64,
                12,
                12
              ],
              [
                543.01,
                64,
                12,
                12
              ],
              [
                573.24,
                64,
                12,
                12
              ],
              [
                603.48,
                64,
                12,
                12
              ],
              [
                633.71,
                64,
                12,
                12
              ],
              [
                663.95,
                64,
                12,
                12
              ],
              [
                694.18,
                64,
                12,
                12
              ],
              [
                724.41,
                64,
                12,
                12
              ],
              [
                754.65,
                64,
                12,
                12
              ],
              [
                784.88,
                64,
                12,
                12
              ],
              [
                815.12,
                64,
                12,
                12
              ],
              [
                845.35,
                64,
                12,
                12
              ],
              [
                875.59,
                64,
                12,
                12
              ],
              [
                905.4,
                68.28,
                12,
                12
              ],
              [
                933.8,
                77.55,
                12,
                12
              ],
              [
                957.89,
                94.84,
                12,
                12
              ],
              [
                974.26,
                120.17,
                12,
                12
              ],
              [
                980.9,
                149.66,
                12,
                12
              ],
              [
                983,
                179.66,
                12,
                12
              ],
              [
                983,
                209.9,
                12,
                12
              ],
              [
                983,
                240.13,
                12,
                12
              ],
              [
                983,
                270.37,
                12,
                12
              ],
              [
                983,
                300.6,
                12,
                12
              ],
              [
                983,
                330.84,
                12,
                12
              ],
              [
                983,
                361.07,
                12,
                12
              ],
              [
                983,
                391.3,
                12,
                12
              ],
              [
                983,
                421.54,
                12,
                12
              ],
              [
                983,
                451.77,
                12,
                12
              ],
              [
                983,
                482.01,
                12,
                12
              ],
              [
                983,
                512.24,
                12,
                12
              ],
              [
                983,
                542.48,
                12,
                12
              ],
              [
                983,
                572.71,
                12,
                12
              ],
              [
                983,
                602.95,
                12,
                12
              ],
              [
                983,
                633.18,
                12,
                12
              ],
              [
                983,
                663.41,
                12,
                12
              ],
              [
                983,
                693.65,
                12,
                12
              ],
              [
                983,
                723.88,
                12,
                12
              ]
            ],
            "rotation": 0,
            "size": 12,
            "pitch": 36,
            "radius": 150,
            "sweep": 120
          },
          "machineCount": 44,
          "machines": [
            {
              "id": "seat:647",
              "number": 647,
              "machineName": "",
              "position": [
                414,
                213.88,
                12,
                12
              ],
              "confidence": null
            },
            {
              "id": "seat:648",
              "number": 648,
              "machineName": "",
              "position": [
                414,
                183.65,
                12,
                12
              ],
              "confidence": null
            },
            {
              "id": "seat:649",
              "number": 649,
              "machineName": "",
              "position": [
                414,
                153.41,
                12,
                12
              ],
              "confidence": null
            },
            {
              "id": "seat:650",
              "number": 650,
              "machineName": "",
              "position": [
                418.24,
                123.53,
                12,
                12
              ],
              "confidence": null
            },
            {
              "id": "seat:651",
              "number": 651,
              "machineName": "",
              "position": [
                432.19,
                97.01,
                12,
                12
              ],
              "confidence": null
            },
            {
              "id": "seat:652",
              "number": 652,
              "machineName": "",
              "position": [
                454.87,
                77.31,
                12,
                12
              ],
              "confidence": null
            },
            {
              "id": "seat:653",
              "number": 653,
              "machineName": "",
              "position": [
                482.98,
                67.15,
                12,
                12
              ],
              "confidence": null
            },
            {
              "id": "seat:654",
              "number": 654,
              "machineName": "",
              "position": [
                512.77,
                64,
                12,
                12
              ],
              "confidence": null
            },
            {
              "id": "seat:655",
              "number": 655,
              "machineName": "",
              "position": [
                543.01,
                64,
                12,
                12
              ],
              "confidence": null
            },
            {
              "id": "seat:656",
              "number": 656,
              "machineName": "",
              "position": [
                573.24,
                64,
                12,
                12
              ],
              "confidence": null
            },
            {
              "id": "seat:657",
              "number": 657,
              "machineName": "",
              "position": [
                603.48,
                64,
                12,
                12
              ],
              "confidence": null
            },
            {
              "id": "seat:658",
              "number": 658,
              "machineName": "",
              "position": [
                633.71,
                64,
                12,
                12
              ],
              "confidence": null
            },
            {
              "id": "seat:659",
              "number": 659,
              "machineName": "",
              "position": [
                663.95,
                64,
                12,
                12
              ],
              "confidence": null
            },
            {
              "id": "seat:660",
              "number": 660,
              "machineName": "",
              "position": [
                694.18,
                64,
                12,
                12
              ],
              "confidence": null
            },
            {
              "id": "seat:661",
              "number": 661,
              "machineName": "",
              "position": [